{
  "id": "cn-shanghai",
  "name": "上海地铁",
  "names": {
    "zh": "上海地铁",
    "en": "Shanghai Metro"
  },
  "city": {
    "id": "CN-31",
    "name": {
      "zh": "上海市",
      "en": "Shanghai"
    },
    "country": "CN",
    "population": 24870895,
    "area": 6341,
    "location": {
      "type": "Point",
      "coordinates": [
        121.469166666,
        31.2325
      ]
    }
  },
  "country_code": "CN",
  "currency": "CNY",
  "timezone": "Asia/Shanghai",
  "coordinate_system": "gcj02",
  "default_units": {
    "distance": "km",
    "time": "seconds",
    "speed": "km/h"
  },
  "routing": {
    "weight": "time",
    "default_transfer_seconds": 120,
    "max_transfer_seconds": 600
  },
  "quality": {
    "topology": {
      "precision": "official",
      "coverage": 1,
      "status": "complete",
      "counts": {
        "official": 1,
        "derived": 0,
        "default": 0
      }
    },
    "coordinates": {
      "precision": "official",
      "coverage": 1,
      "status": "complete",
      "counts": {
        "official": 417,
        "derived": 0,
        "default": 0
      }
    },
    "names": {
      "precision": "official",
      "coverage": 1,
      "status": "complete",
      "counts": {
        "official": 417,
        "derived": 0,
        "default": 0
      }
    },
    "segment_times": {
      "precision": "official",
      "coverage": 1,
      "status": "complete",
      "counts": {
        "official": 510,
        "derived": 0,
        "default": 0
      }
    },
    "segment_distances": {
      "precision": "derived",
      "coverage": 1,
      "status": "derived",
      "counts": {
        "official": 0,
        "derived": 510,
        "default": 0
      }
    },
    "transfer_times": {
      "precision": "official",
      "coverage": 1,
      "status": "complete",
      "counts": {
        "official": 276,
        "derived": 0,
        "default": 0
      }
    },
    "timetables": {
      "precision": "official",
      "coverage": 1,
      "status": "complete",
      "counts": {
        "official": 1238,
        "derived": 0,
        "default": 0
      }
    },
    "schematic": {
      "precision": "default",
      "coverage": 0,
      "status": "unavailable",
      "counts": {
        "official": 0,
        "derived": 0,
        "default": 530
      }
    },
    "fares": {
      "precision": "official",
      "coverage": 0.99,
      "status": "partial",
      "counts": {
        "official": 171212,
        "derived": 0,
        "default": 2260
      }
    }
  }
}
