{
  "id": "cn-xiamen",
  "name": "厦门地铁",
  "names": {
    "zh": "厦门地铁",
    "en": "Xiamen Metro"
  },
  "city": {
    "id": "CN-3502",
    "name": {
      "zh": "厦门市",
      "en": "Xiamen"
    },
    "country": "CN",
    "population": 5163970,
    "area": 1699.39,
    "location": {
      "type": "Point",
      "coordinates": [
        118.081944444,
        24.479722222
      ]
    }
  },
  "country_code": "CN",
  "currency": "CNY",
  "timezone": "Asia/Shanghai",
  "coordinate_system": "gcj02",
  "default_units": {
    "distance": "km",
    "time": "seconds",
    "speed": "km/h"
  },
  "routing": {
    "weight": "time",
    "default_transfer_seconds": 120,
    "max_transfer_seconds": 600
  },
  "notes": "拓扑/坐标/示意图来自 AMap Subway，并与官网 CMS（xmgdjt.com.cn/api/transit）逐线站表交叉校验；线路颜色/服务时段/官方站点编号来自官网 CMS；1–3 号线首末班来自官网 CMS（含目的站），4/6 号线 CMS 无时刻记录、由百度路径规划（directionlite transit）收割，2 号线个别缺记录站点同样以百度补齐；票价来自官网票价查询接口（仅数字编号站点，4/6 号线未发布为 null）。官网同页还提供 3 条 BRT 线路（type=2），非轨道交通制式，未收录。",
  "quality": {
    "topology": {
      "precision": "official",
      "coverage": 1,
      "status": "complete",
      "counts": {
        "official": 1,
        "derived": 0,
        "default": 0
      }
    },
    "coordinates": {
      "precision": "official",
      "coverage": 1,
      "status": "complete",
      "counts": {
        "official": 92,
        "derived": 0,
        "default": 0
      }
    },
    "names": {
      "precision": "official",
      "coverage": 1,
      "status": "complete",
      "counts": {
        "official": 92,
        "derived": 0,
        "default": 0
      }
    },
    "segment_times": {
      "precision": "derived",
      "coverage": 1,
      "status": "derived",
      "counts": {
        "official": 0,
        "derived": 97,
        "default": 0
      }
    },
    "segment_distances": {
      "precision": "derived",
      "coverage": 1,
      "status": "derived",
      "counts": {
        "official": 0,
        "derived": 97,
        "default": 0
      }
    },
    "transfer_times": {
      "precision": "default",
      "coverage": 0,
      "status": "unavailable",
      "counts": {
        "official": 0,
        "derived": 0,
        "default": 20
      }
    },
    "timetables": {
      "precision": "official",
      "coverage": 1,
      "status": "complete",
      "counts": {
        "official": 194,
        "derived": 0,
        "default": 0
      }
    },
    "schematic": {
      "precision": "official",
      "coverage": 1,
      "status": "complete",
      "counts": {
        "official": 102,
        "derived": 0,
        "default": 0
      }
    },
    "fares": {
      "precision": "official",
      "coverage": 0.61,
      "status": "partial",
      "counts": {
        "official": 5134,
        "derived": 0,
        "default": 3238
      }
    }
  }
}
