{
  "id": "cn-nanning",
  "name": "南宁轨道交通",
  "names": {
    "zh": "南宁轨道交通",
    "en": "Nanning Rail Transit"
  },
  "city": {
    "id": "CN-4501",
    "name": {
      "zh": "南宁市",
      "en": "Nanning"
    },
    "country": "CN",
    "population": 8741584,
    "area": 22099.31,
    "location": {
      "type": "Point",
      "coordinates": [
        108.31501,
        22.81918
      ]
    }
  },
  "country_code": "CN",
  "currency": "CNY",
  "timezone": "Asia/Shanghai",
  "coordinate_system": "gcj02",
  "default_units": {
    "distance": "km",
    "time": "seconds",
    "speed": "km/h"
  },
  "routing": {
    "weight": "time",
    "default_transfer_seconds": 120,
    "max_transfer_seconds": 600
  },
  "notes": "拓扑与站序来自运营方官网的服务端渲染页面 GET https://www.nngdjt.com/traffic/subway/?pageIndex=1：1 号线 25 站（火车东站→石埠）、2 号线 23 站（西津→坛泽）、3 号线 23 站（科园大道→平良立交）、4 号线 19 站（洪运路→龙岗）、5 号线 17 站（国凯大道→金桥客运站），共 107 条 line-stop 记录、96 座物理车站、11 座换乘站（金湖广场、朝阳广场、火车站、广西大学、安吉客运站、明秀路、大沙田、平良立交、小鸡村、总部基地、那洪立交）。4 号线的五象火车站官网时刻表六个时间列均为「/」、运营线网图亦未收录，属已官宣未通车，按仓库既有的支线交路模型记为 under_construction（保留停站与区间，主运营链不被拆断）。每站详情块另给出车站描述、全部出入口（含每个口的周边地标，共 407 条）、换乘指引与设施示意图。坐标、示意图像素、线内站码、拼音、英文名与线色来自 AMap Subway 4501（GCJ-02 原生；AMap 尚无五象火车站，站序与官网一致）。逐站逐方向首末班来自百度路径规划 direction/v2/transit（tactics_incity=5 地铁优先）：该接口给出上车站自身的首班/末班发车时刻，与官网首末班车时刻表逐格一致（192 组比对中 190 组完全一致，官网仅以图片发布该表，未做 OCR）。OD 票价来自同一规划器的逐 OD 报价，官网未提供票价矩阵也未提供路径规划器；票务须知图给出官方里程分段计价规则（起步 2 元/6 公里，之后 6/6/8/8 公里各加 1 元，34 公里以上每 10 公里加 1 元）用于交叉校验与缺格兜底。换乘步行时间官方不提供，依赖 core 的 gapfill 层由百度规划器补齐。区间里程共 102 段，其中 98 段取自百度规划器逐区间实测；余下 4 段保留直线距离估算：楞塘村→五象火车站的终点是已官宣未通车站，规划器不给出该 OD 的路线；大沙田→金象大道（4 号线）、福建园→亭洪路（2 号线）、小鸡村→邕宾立交（5 号线）两端均已运营，但规划器对这些 OD 只给出公交与步行方案，没有地铁方案，故不套用公交里程，改用直线距离估算。",
  "quality": {
    "topology": {
      "precision": "official",
      "coverage": 1,
      "status": "complete",
      "counts": {
        "official": 1,
        "derived": 0,
        "default": 0
      }
    },
    "coordinates": {
      "precision": "official",
      "coverage": 1,
      "status": "complete",
      "counts": {
        "official": 96,
        "derived": 0,
        "default": 0
      }
    },
    "names": {
      "precision": "official",
      "coverage": 1,
      "status": "complete",
      "counts": {
        "official": 96,
        "derived": 0,
        "default": 0
      }
    },
    "segment_times": {
      "precision": "official",
      "coverage": 1,
      "status": "complete",
      "counts": {
        "official": 98,
        "derived": 4,
        "default": 0
      }
    },
    "segment_distances": {
      "precision": "official",
      "coverage": 1,
      "status": "complete",
      "counts": {
        "official": 98,
        "derived": 4,
        "default": 0
      }
    },
    "transfer_times": {
      "precision": "official",
      "coverage": 1,
      "status": "complete",
      "counts": {
        "official": 22,
        "derived": 0,
        "default": 0
      }
    },
    "timetables": {
      "precision": "official",
      "coverage": 1,
      "status": "complete",
      "counts": {
        "official": 202,
        "derived": 0,
        "default": 0
      }
    },
    "schematic": {
      "precision": "official",
      "coverage": 0.99,
      "status": "partial",
      "counts": {
        "official": 106,
        "derived": 0,
        "default": 1
      }
    },
    "fares": {
      "precision": "official",
      "coverage": 1,
      "status": "complete",
      "counts": {
        "official": 9106,
        "derived": 0,
        "default": 14
      }
    }
  }
}
