{
  "id": "cn-hefei",
  "name": "合肥地铁",
  "names": {
    "zh": "合肥地铁",
    "en": "Hefei Metro"
  },
  "city": {
    "id": "CN-3401",
    "name": {
      "zh": "合肥市",
      "en": "Hefei"
    },
    "country": "CN",
    "population": 9369881,
    "area": 11445.06,
    "location": {
      "type": "Point",
      "coordinates": [
        117.28083,
        31.86389
      ]
    }
  },
  "country_code": "CN",
  "currency": "CNY",
  "timezone": "Asia/Shanghai",
  "coordinate_system": "gcj02",
  "default_units": {
    "distance": "km",
    "time": "seconds",
    "speed": "km/h"
  },
  "routing": {
    "weight": "time",
    "default_transfer_seconds": 180,
    "max_transfer_seconds": 900
  },
  "notes": "线网拓扑（线路、站序、线色、示意图像素）、坐标与英文名取自 AMap Subway 3401_drw_hefei.json（GCJ-02 原生，8 线 215 站序行 / 195 座车站全部带坐标、英文名与像素位置）。官方结构化运营数据不在集团官网（www.hfgdjt.com 是网页隔离代理壳，无任何业务接口），而在合肥市人民政府政府信息公开平台「合肥市轨道交通集团有限公司」栏目（organId=156407）：《首末班车时间及行车间隔》给出 8 条线、周一至周四工作日/周五工作日/双休日三个服务日带的首末班时刻、始发站、终到站与最小行车间隔；《票价信息及优惠政策》给出里程分段计价票制（起步 2 元 8 公里，8-14 公里 3 元，14-21 公里 4 元，21-29 公里 5 元，29 公里以上每 9 公里加收 1 元）；《运营线路》给出官方运营线网图。官方时刻表只公布首班车始发站与末班车终到站，逐站首末班由百度路径规划 direction/v2/transit 补齐——在官方公布的 7 个终点站上与官方表逐格一致（九联圩 06:00/22:50、合肥南站 06:04/23:55、张洼 06:00/23:10、南岗 06:00/23:00、相城路 06:00/22:25、龙塘 06:00/22:00、一里井 06:00/22:30，2026-10-23 周五）。官方线网图把馆驿（3 号线）、紫云湖（4 号线）、市博物馆（6 号线）标为暂未开通。三站状态均记为 under_construction，建模方式按其在线路中的位置区分：馆驿与紫云湖在线路末端之外，记为挂在相邻运营站上的支线交路；市博物馆位于市儿童医院与钢红之间，保留在 6 号线的官方站序中，运营交路不在该站停靠，乘车区间按贯通运行建模——市儿童医院→钢红 是运营方实际开行的一个区间，而非两个相邻站区间。三种情况下路由图都丢弃这些站，运营主线不被拆断。官方时刻表按三个服务日带（周一至周四工作日 / 周五工作日 / 双休日）公布，落盘为 7 元素星期数组；中间车站的时刻由百度规划器补齐，规划器只回答采集当日所在的服务日带，该档位记录在 timetables 的 service_band 中。规划器的方向标签在 3 号线与 4 号线指向仍在建的馆驿与紫云湖，方向一律以官方定义为准，规划器原标签保留在 extras.planner_direction。官方不发布区间运行时间、区间里程、换乘步行时间与站内出入口信息，这三类数据由百度规划器与 core 的 gapfill 层补齐。区间里程以百度路径规划逐区间实测为准；个别 OD 规划器不给出路线（终点是官网标注暂未开通的车站），或只给出公交与步行方案、没有地铁方案，此时不套用公交里程，改用直线距离估算——这类区间在 segments.json 中以 distance_source=haversine 标注，数量随规划器当次的应答而定。",
  "quality": {
    "topology": {
      "precision": "official",
      "coverage": 1,
      "status": "complete",
      "counts": {
        "official": 1,
        "derived": 0,
        "default": 0
      }
    },
    "coordinates": {
      "precision": "official",
      "coverage": 1,
      "status": "complete",
      "counts": {
        "official": 195,
        "derived": 3,
        "default": 0
      }
    },
    "names": {
      "precision": "official",
      "coverage": 1,
      "status": "complete",
      "counts": {
        "official": 198,
        "derived": 0,
        "default": 0
      }
    },
    "segment_times": {
      "precision": "official",
      "coverage": 1,
      "status": "complete",
      "counts": {
        "official": 206,
        "derived": 3,
        "default": 0
      }
    },
    "segment_distances": {
      "precision": "official",
      "coverage": 1,
      "status": "complete",
      "counts": {
        "official": 206,
        "derived": 3,
        "default": 0
      }
    },
    "transfer_times": {
      "precision": "official",
      "coverage": 1,
      "status": "complete",
      "counts": {
        "official": 42,
        "derived": 0,
        "default": 0
      }
    },
    "timetables": {
      "precision": "official",
      "coverage": 1,
      "status": "complete",
      "counts": {
        "official": 415,
        "derived": 0,
        "default": 0
      }
    },
    "schematic": {
      "precision": "official",
      "coverage": 0.99,
      "status": "partial",
      "counts": {
        "official": 215,
        "derived": 0,
        "default": 3
      }
    },
    "fares": {
      "precision": "official",
      "coverage": 0.97,
      "status": "partial",
      "counts": {
        "official": 37830,
        "derived": 0,
        "default": 1176
      }
    }
  }
}
