{
  "id": "cn-alishan-railway",
  "name": "阿里山森林鐵路",
  "names": {
    "zh": "阿里山森林鐵路",
    "en": "Alishan Forest Railway"
  },
  "city": {
    "id": "CN-71",
    "name": {
      "zh": "台湾省",
      "en": "Taiwan Province"
    },
    "country": "CN",
    "population": 23140000,
    "area": 35581,
    "location": {
      "type": "Point",
      "coordinates": [
        121,
        23.7
      ]
    }
  },
  "country_code": "CN",
  "currency": "TWD",
  "timezone": "Asia/Taipei",
  "coordinate_system": "wgs84",
  "default_units": {
    "distance": "km",
    "time": "s",
    "speed": "km/h"
  },
  "routing": {
    "weight": "time",
    "default_transfer_seconds": 180,
    "max_transfer_seconds": 900
  },
  "notes": "涵蓋阿里山本線、神木線、沼平線及祝山線。本線與前兩條支線採官方定期班表；祝山線僅提供公告日期的觀日首班與回程末班，其他時間未公布。直達車依實際停靠站規劃，圖上沿完整線路走向顯示，途經不代表停靠。耗時包含班表已知的中途停站時間，仍為靜態估算，不保證候車或班次銜接。票價分本線與支線列示，未推算聯程票價；眠月線與水山步道不納入。",
  "service_scope": "涵蓋阿里山本線、神木線、沼平線及祝山線。本線與前兩條支線採官方定期班表；祝山線僅提供公告日期的觀日首班與回程末班，其他時間未公布。直達車依實際停靠站規劃，圖上沿完整線路走向顯示，途經不代表停靠。耗時包含班表已知的中途停站時間，仍為靜態估算，不保證候車或班次銜接。票價分本線與支線列示，未推算聯程票價；眠月線與水山步道不納入。",
  "quality": {
    "topology": {
      "precision": "official",
      "coverage": 1,
      "status": "complete",
      "counts": {
        "official": 1,
        "derived": 0,
        "default": 0
      }
    },
    "coordinates": {
      "precision": "derived",
      "coverage": 1,
      "status": "derived",
      "counts": {
        "official": 0,
        "derived": 18,
        "default": 0
      }
    },
    "names": {
      "precision": "derived",
      "coverage": 1,
      "status": "derived",
      "counts": {
        "official": 0,
        "derived": 18,
        "default": 0
      }
    },
    "segment_times": {
      "precision": "official",
      "coverage": 1,
      "status": "complete",
      "counts": {
        "official": 18,
        "derived": 2,
        "default": 0
      }
    },
    "segment_distances": {
      "precision": "official",
      "coverage": 1,
      "status": "complete",
      "counts": {
        "official": 14,
        "derived": 6,
        "default": 0
      }
    },
    "transfer_times": {
      "precision": "default",
      "coverage": 0,
      "status": "unavailable",
      "counts": {
        "official": 0,
        "derived": 0,
        "default": 12
      }
    },
    "timetables": {
      "precision": "official",
      "coverage": 0.35,
      "status": "partial",
      "counts": {
        "official": 14,
        "derived": 2,
        "default": 2,
        "unknown_directions": 22
      }
    },
    "schematic": {
      "precision": "default",
      "coverage": 0,
      "status": "unavailable",
      "counts": {
        "official": 0,
        "derived": 0,
        "default": 21
      }
    },
    "fares": {
      "precision": "official",
      "coverage": 0.61,
      "status": "partial",
      "counts": {
        "official": 188,
        "derived": 0,
        "default": 118
      }
    }
  }
}