{
  "id": "cn-beijing",
  "name": "北京地铁",
  "names": {
    "zh": "北京地铁",
    "en": "Beijing Subway"
  },
  "city": {
    "id": "CN-11",
    "name": {
      "zh": "北京市",
      "en": "Beijing"
    },
    "country": "CN",
    "population": 21893095,
    "area": 16410.54,
    "location": {
      "type": "Point",
      "coordinates": [
        116.407526,
        39.90403
      ]
    }
  },
  "country_code": "CN",
  "currency": "CNY",
  "timezone": "Asia/Shanghai",
  "coordinate_system": "gcj02",
  "default_units": {
    "distance": "km",
    "time": "seconds",
    "speed": "km/h"
  },
  "routing": {
    "weight": "time",
    "default_transfer_seconds": 120,
    "max_transfer_seconds": 600
  },
  "quality": {
    "topology": {
      "precision": "official",
      "coverage": 1,
      "status": "complete",
      "counts": {
        "official": 1,
        "derived": 0,
        "default": 0
      }
    },
    "coordinates": {
      "precision": "official",
      "coverage": 1,
      "status": "complete",
      "counts": {
        "official": 411,
        "derived": 15,
        "default": 0
      }
    },
    "names": {
      "precision": "official",
      "coverage": 1,
      "status": "complete",
      "counts": {
        "official": 426,
        "derived": 0,
        "default": 0
      }
    },
    "segment_times": {
      "precision": "official",
      "coverage": 1,
      "status": "complete",
      "counts": {
        "official": 487,
        "derived": 28,
        "default": 0
      }
    },
    "segment_distances": {
      "precision": "derived",
      "coverage": 1,
      "status": "derived",
      "counts": {
        "official": 73,
        "derived": 442,
        "default": 0
      }
    },
    "transfer_times": {
      "precision": "official",
      "coverage": 0.84,
      "status": "partial",
      "counts": {
        "official": 114,
        "derived": 101,
        "default": 41
      }
    },
    "timetables": {
      "precision": "official",
      "coverage": 1,
      "status": "complete",
      "counts": {
        "official": 1004,
        "derived": 0,
        "default": 0
      }
    },
    "schematic": {
      "precision": "official",
      "coverage": 1,
      "status": "complete",
      "counts": {
        "official": 543,
        "derived": 0,
        "default": 0
      }
    },
    "fares": {
      "precision": "official",
      "coverage": 0.99,
      "status": "partial",
      "counts": {
        "official": 179352,
        "derived": 0,
        "default": 1698
      }
    }
  }
}
