{
  "id": "cn-sz",
  "name": "苏州轨道交通",
  "names": {
    "zh": "苏州轨道交通",
    "en": "Suzhou Rail Transit"
  },
  "city": {
    "id": "CN-32",
    "name": {
      "zh": "苏州",
      "en": "Suzhou"
    },
    "country": "CN",
    "population": 12911000,
    "area": 8657.32,
    "location": {
      "type": "Point",
      "coordinates": [
        120.58529,
        31.29888
      ]
    }
  },
  "country_code": "CN",
  "currency": "CNY",
  "timezone": "Asia/Shanghai",
  "coordinate_system": "gcj02",
  "default_units": {
    "distance": "km",
    "time": "seconds",
    "speed": "km/h"
  },
  "routing": {
    "weight": "time",
    "default_transfer_seconds": 300,
    "max_transfer_seconds": 900
  },
  "notes": "3号线与11号线贯通运营，常规列车无需在唯亭下车换乘。票价：起步价2元可乘6公里；6～16公里每1元可乘5公里；16～30公里每1元可乘7公里；30公里以上每1元可乘9公里。",
  "quality": {
    "topology": {
      "precision": "official",
      "coverage": 1,
      "status": "complete",
      "counts": {
        "official": 1,
        "derived": 0,
        "default": 0
      }
    },
    "coordinates": {
      "precision": "official",
      "coverage": 1,
      "status": "complete",
      "counts": {
        "official": 235,
        "derived": 4,
        "default": 0
      }
    },
    "names": {
      "precision": "official",
      "coverage": 1,
      "status": "complete",
      "counts": {
        "official": 239,
        "derived": 0,
        "default": 0
      }
    },
    "segment_times": {
      "precision": "official",
      "coverage": 0.99,
      "status": "partial",
      "counts": {
        "official": 266,
        "derived": 0,
        "default": 4
      }
    },
    "segment_distances": {
      "precision": "official",
      "coverage": 0.99,
      "status": "partial",
      "counts": {
        "official": 266,
        "derived": 0,
        "default": 4
      }
    },
    "transfer_times": {
      "precision": "derived",
      "coverage": 1,
      "status": "derived",
      "counts": {
        "official": 0,
        "derived": 80,
        "default": 0
      }
    },
    "timetables": {
      "precision": "official",
      "coverage": 1,
      "status": "complete",
      "counts": {
        "official": 457,
        "derived": 0,
        "default": 0
      }
    },
    "schematic": {
      "precision": "official",
      "coverage": 1,
      "status": "complete",
      "counts": {
        "official": 279,
        "derived": 0,
        "default": 0
      }
    }
  }
}