{
  "id": "cn-taiwan-hsr",
  "name": "台灣高鐵",
  "names": {
    "zh": "台灣高鐵",
    "en": "Taiwan High Speed Rail"
  },
  "city": {
    "id": "CN-71",
    "name": {
      "zh": "台湾省",
      "en": "Taiwan Province"
    },
    "country": "CN",
    "population": 23140000,
    "area": 35581,
    "location": {
      "type": "Point",
      "coordinates": [
        121,
        23.7
      ]
    }
  },
  "country_code": "CN",
  "currency": "TWD",
  "timezone": "Asia/Taipei",
  "coordinate_system": "wgs84",
  "default_units": {
    "distance": "km",
    "time": "s",
    "speed": "km/h"
  },
  "routing": {
    "weight": "time",
    "default_transfer_seconds": 180,
    "max_transfer_seconds": 900
  },
  "notes": "台灣高鐵 2026-10-16 的官方班表，包含區間車與各站停靠資訊。票價為標準車廂成人對號座單程全票，不含優惠、商務車廂與自由座。行程耗時為靜態估算，不含候車、班次銜接與訂位；請依實際班次確認停靠站。",
  "service_scope": "台灣高鐵 2026-10-16 的官方班表，包含區間車與各站停靠資訊。票價為標準車廂成人對號座單程全票，不含優惠、商務車廂與自由座。行程耗時為靜態估算，不含候車、班次銜接與訂位；請依實際班次確認停靠站。",
  "quality": {
    "topology": {
      "precision": "official",
      "coverage": 1,
      "status": "complete",
      "counts": {
        "official": 1,
        "derived": 0,
        "default": 0
      }
    },
    "coordinates": {
      "precision": "derived",
      "coverage": 1,
      "status": "derived",
      "counts": {
        "official": 0,
        "derived": 12,
        "default": 0
      }
    },
    "names": {
      "precision": "derived",
      "coverage": 1,
      "status": "derived",
      "counts": {
        "official": 0,
        "derived": 12,
        "default": 0
      }
    },
    "segment_times": {
      "precision": "official",
      "coverage": 1,
      "status": "complete",
      "counts": {
        "official": 11,
        "derived": 0,
        "default": 0
      }
    },
    "segment_distances": {
      "precision": "derived",
      "coverage": 1,
      "status": "derived",
      "counts": {
        "official": 0,
        "derived": 11,
        "default": 0
      }
    },
    "transfer_times": {
      "precision": "default",
      "coverage": 0,
      "status": "unavailable",
      "counts": {
        "official": 0,
        "derived": 0,
        "default": 0
      }
    },
    "timetables": {
      "precision": "official",
      "coverage": 1,
      "status": "complete",
      "counts": {
        "official": 22,
        "derived": 0,
        "default": 0
      }
    },
    "schematic": {
      "precision": "default",
      "coverage": 0,
      "status": "unavailable",
      "counts": {
        "official": 0,
        "derived": 0,
        "default": 12
      }
    },
    "fares": {
      "precision": "official",
      "coverage": 1,
      "status": "complete",
      "counts": {
        "official": 132,
        "derived": 0,
        "default": 0
      }
    }
  }
}