{
  "id": "cn-shijiazhuang",
  "name": "石家庄地铁",
  "names": {
    "zh": "石家庄地铁",
    "en": "Shijiazhuang Metro"
  },
  "city": {
    "id": "CN-1301",
    "name": {
      "zh": "石家庄市",
      "en": "Shijiazhuang"
    },
    "country": "CN",
    "population": 10640458,
    "area": 14060.14,
    "location": {
      "type": "Point",
      "coordinates": [
        114.51,
        38.0425
      ]
    }
  },
  "country_code": "CN",
  "currency": "CNY",
  "timezone": "Asia/Shanghai",
  "coordinate_system": "gcj02",
  "default_units": {
    "distance": "km",
    "time": "seconds",
    "speed": "km/h"
  },
  "routing": {
    "weight": "time",
    "default_transfer_seconds": 120,
    "max_transfer_seconds": 600
  },
  "notes": "拓扑/站序/换乘关系/线色来自官网 sjzmetro.cn /metro/lines.html 与 /metro/stations.html（站序取响应数组下标，官方 order_on_line 对换乘站有误；坐标字段恒为空）。坐标/拼音英文名来自 AMap Subway 1301。逐站首末班、区间时间距离、换乘步行与 OD 票价来自百度路径规划 direction/v2/transit：官网首末班车时刻表与票价表仅以图片发布，未做 OCR；官网 /metro/recommend.html 返回的是全线服务窗口而非逐站首末班，其票价字段恒为起步价 2 元，均不采用。工作日与双休日的逐站首末班差异仅存在于官网图片时刻表中，机器可读源无法区分，故此层只发布单一变体。三座换乘站的站厅步行在规划器中均为同一模型值（231 米 / 193 秒），非逐站实测。在建的 1 号线二/三期、4/5/6 号线一期无结构化站表，未建模。",
  "quality": {
    "topology": {
      "precision": "official",
      "coverage": 1,
      "status": "complete",
      "counts": {
        "official": 1,
        "derived": 0,
        "default": 0
      }
    },
    "coordinates": {
      "precision": "official",
      "coverage": 1,
      "status": "complete",
      "counts": {
        "official": 60,
        "derived": 0,
        "default": 0
      }
    },
    "names": {
      "precision": "official",
      "coverage": 1,
      "status": "complete",
      "counts": {
        "official": 60,
        "derived": 0,
        "default": 0
      }
    },
    "segment_times": {
      "precision": "official",
      "coverage": 1,
      "status": "complete",
      "counts": {
        "official": 60,
        "derived": 0,
        "default": 0
      }
    },
    "segment_distances": {
      "precision": "official",
      "coverage": 1,
      "status": "complete",
      "counts": {
        "official": 60,
        "derived": 0,
        "default": 0
      }
    },
    "transfer_times": {
      "precision": "official",
      "coverage": 1,
      "status": "complete",
      "counts": {
        "official": 6,
        "derived": 0,
        "default": 0
      }
    },
    "timetables": {
      "precision": "official",
      "coverage": 1,
      "status": "complete",
      "counts": {
        "official": 120,
        "derived": 0,
        "default": 0
      }
    },
    "schematic": {
      "precision": "official",
      "coverage": 1,
      "status": "complete",
      "counts": {
        "official": 63,
        "derived": 0,
        "default": 0
      }
    },
    "fares": {
      "precision": "official",
      "coverage": 1,
      "status": "complete",
      "counts": {
        "official": 3540,
        "derived": 0,
        "default": 0
      }
    }
  }
}
